[
  {
    "document_id": "fixture:text-search-fixture",
    "document_sha256": "f7e2b4436614640779c890a882537d543cf4579ae6cc43ad5f43f193afa6cd7f",
    "page_index": 0,
    "span_id": "page-0-span-0",
    "text": "Fe Reader Search Fixture\n",
    "bbox": [0, 0, 0, 0],
    "reading_order": 0,
    "language_hint": "en"
  }
]
